{
  "$schema": "http://json-schema.org/draft-07/schema#",
  "title": "TLCTC Framework Definition (Static) — Schema",
  "description": "Validates a TLCTC framework release package (e.g., v2.0). This is the immutable dictionary of clusters, axioms, and core rule identifiers.",
  "type": "object",
  "additionalProperties": false,
  "required": ["metadata", "clusters", "axioms", "rules"],
  "properties": {
    "metadata": {
      "type": "object",
      "additionalProperties": false,
      "required": ["tlctc_version", "release_date"],
      "properties": {
        "tlctc_version": { "type": "string", "pattern": "^\\d+\\.\\d+$" },
        "release_date": { "type": "string", "format": "date" },
        "schema_id": { "type": "string", "examples": ["tlctc-framework"] },
        "schema_version": { "type": "string", "examples": ["2.0.0"] },
        "publisher": { "type": "string" },
        "license": { "type": "string" },
        "notes": { "type": "string" }
      }
    },
    "clusters": {
      "type": "object",
      "description": "The canonical set of 10 strategic clusters keyed by strategic ID.",
      "additionalProperties": false,
      "required": ["#1", "#2", "#3", "#4", "#5", "#6", "#7", "#8", "#9", "#10"],
      "properties": {
        "#1": { "$ref": "#/definitions/cluster_def" },
        "#2": { "$ref": "#/definitions/cluster_def" },
        "#3": { "$ref": "#/definitions/cluster_def" },
        "#4": { "$ref": "#/definitions/cluster_def" },
        "#5": { "$ref": "#/definitions/cluster_def" },
        "#6": { "$ref": "#/definitions/cluster_def" },
        "#7": { "$ref": "#/definitions/cluster_def" },
        "#8": { "$ref": "#/definitions/cluster_def" },
        "#9": { "$ref": "#/definitions/cluster_def" },
        "#10": { "$ref": "#/definitions/cluster_def" }
      }
    },
    "axioms": {
      "type": "array",
      "description": "The immutable axiom set for this TLCTC release.",
      "minItems": 1,
      "items": { "$ref": "#/definitions/axiom_def" }
    },
    "rules": {
      "type": "array",
      "description": "Rule identifiers referenced by tooling and validation layers (e.g., R-EXEC).",
      "minItems": 1,
      "items": { "$ref": "#/definitions/rule_def" }
    },
    "fec": {
      "type": "object",
      "description": "Foreign Executable Content and the data-vs-code boundary (v2.6): what counts as execution for R-EXEC.",
      "additionalProperties": false,
      "required": ["definition", "general_purpose_engines", "data_languages", "boundary"],
      "properties": {
        "definition": { "type": "string" },
        "general_purpose_engines": { "type": "array", "minItems": 1, "items": { "type": "string" } },
        "data_languages": { "type": "array", "minItems": 1, "items": { "type": "string" } },
        "boundary": { "type": "string" },
        "notes": { "type": "string" }
      }
    },
    "data_risk_events": {
      "type": "object",
      "description": "Data Risk Event (DRE) type codes as a refinement tree (v2.5): three parent properties, two admitted refinements, and the stopping rule that admits them. Outcome annotations only — never clusters, never classification inputs (Axiom III).",
      "additionalProperties": false,
      "required": ["description", "stopping_rule", "codes"],
      "properties": {
        "description": { "type": "string" },
        "stopping_rule": { "type": "string" },
        "codes": {
          "type": "array",
          "minItems": 1,
          "items": { "$ref": "#/definitions/dre_def" }
        }
      }
    },
    "cause_side_partition": {
      "type": "object",
      "description": "The four-row partition of the cause side (failure, error in use, abuse of rights, attack) by three ordered questions; only the attack row is in TLCTC scope (R-SCOPE).",
      "additionalProperties": false,
      "required": ["description", "questions", "rows", "decision_procedure"],
      "properties": {
        "description": { "type": "string" },
        "questions": { "type": "array", "minItems": 3, "maxItems": 3, "items": { "type": "string" } },
        "rows": { "type": "array", "minItems": 4, "maxItems": 4, "items": { "$ref": "#/definitions/partition_row_def" } },
        "entitlement": { "type": "object", "additionalProperties": { "type": "string" } },
        "third_party_modifier": { "type": "string" },
        "decision_procedure": { "type": "array", "minItems": 1, "items": { "type": "string" } },
        "notes": { "type": "string" }
      }
    },
    "system_risk_event": {
      "type": "object",
      "description": "The System Risk Event. The framework defines one type, System Compromise (loss of control, reached only through cluster steps, the cyber pivot); other events at the same altitude that serve no attacker's objective (System Failure foremost) are operational risk and are named only to place the boundary.",
      "additionalProperties": false,
      "required": ["definition", "types"],
      "properties": {
        "definition": { "type": "string" },
        "types": { "type": "array", "minItems": 1, "maxItems": 1, "items": { "$ref": "#/definitions/sre_type_def" } },
        "other_system_altitude_events": { "type": "object", "additionalProperties": false, "required": ["description", "examples"], "properties": { "description": { "type": "string" }, "examples": { "type": "array", "minItems": 1, "items": { "$ref": "#/definitions/sre_type_def" } } } },
        "notes": { "type": "string" }
      }
    },
    "consequence_chain": {
      "type": "object",
      "description": "The consequence chain SRE -> DRE -> BRE*: the BRE definition, the edge kinds on the chain, and the entry points named to place the boundary of the clusters (v2.7).",
      "additionalProperties": false,
      "required": ["description", "business_risk_event", "edges", "entry_points"],
      "properties": {
        "description": { "type": "string" },
        "business_risk_event": {
          "type": "object",
          "additionalProperties": false,
          "required": ["definition"],
          "properties": {
            "definition": { "type": "string" },
            "examples": { "type": "array", "items": { "type": "string" } }
          }
        },
        "edges": {
          "type": "array",
          "minItems": 2,
          "items": {
            "type": "object",
            "additionalProperties": false,
            "required": ["kind", "delta_t", "definition"],
            "properties": {
              "kind": { "enum": ["causal", "normative"] },
              "delta_t": { "type": "boolean" },
              "definition": { "type": "string" }
            },
            "if": { "properties": { "kind": { "const": "normative" } } },
            "then": { "properties": { "delta_t": { "const": false } } }
          }
        },
        "entry_points": {
          "type": "array",
          "minItems": 1,
          "items": {
            "type": "object",
            "additionalProperties": false,
            "required": ["altitude", "row", "cluster_applies", "definition"],
            "properties": {
              "altitude": { "enum": ["SRE", "DRE", "BRE", "any"] },
              "row": { "enum": ["attack", "failure", "error_in_use", "abuse_of_rights", "none"] },
              "cluster_applies": { "type": "boolean" },
              "definition": { "type": "string" }
            }
          }
        },
        "notes": { "type": "string" }
      }
    },
    "changes_from_v2_5": {
      "type": "array",
      "description": "v2.6 change record: one entry per change item, traced to the review point it answers.",
      "items": {
        "type": "object",
        "additionalProperties": false,
        "required": ["id", "review_point", "summary", "affects"],
        "properties": {
          "id": { "type": "string", "pattern": "^C\\d+$" },
          "review_point": { "type": "string" },
          "summary": { "type": "string" },
          "affects": { "type": "array", "minItems": 1, "items": { "type": "string" } }
        }
      }
    },
    "changes_from_v2_6": {
      "type": "array",
      "description": "v2.7 change record: one entry per change item, traced to its source.",
      "items": {
        "type": "object",
        "additionalProperties": false,
        "required": ["id", "review_point", "summary", "affects"],
        "properties": {
          "id": { "type": "string", "pattern": "^C\\d+$" },
          "review_point": { "type": "string" },
          "summary": { "type": "string" },
          "affects": { "type": "array", "minItems": 1, "items": { "type": "string" } }
        }
      }
    },
    "extensions": {
      "type": "object",
      "description": "Forward-compatible container for non-standard fields."
    }
  },
  "definitions": {
    "strategic_id": {
      "type": "string",
      "pattern": "^(#[1-9]|#10)$"
    },
    "operational_root_id": {
      "type": "string",
      "pattern": "^TLCTC-(0[1-9]|10)\\.00$",
      "description": "Operational root identifier for the strategic cluster (XX.00)."
    },
    "topology_type": {
      "type": "string",
      "enum": ["internal", "bridge"],
      "description": "internal = cyber-domain technical surface; bridge = generic vulnerability outside the software domain (human/physical/third-party trust)."
    },
    "cluster_def": {
      "type": "object",
      "additionalProperties": false,
      "required": ["strategic_id", "operational_root_id", "name", "definition", "attackers_view", "generic_vulnerability", "topology"],
      "properties": {
        "strategic_id": { "$ref": "#/definitions/strategic_id" },
        "operational_root_id": { "$ref": "#/definitions/operational_root_id" },
        "name": { "type": "string" },
        "definition": { "type": "string" },
        "attackers_view": { "type": "string" },
        "generic_vulnerability": { "type": "string" },
        "topology": { "$ref": "#/definitions/topology_type" },
        "operational_sub_threats": {
          "type": "array",
          "description": "Optional controlled vocabulary for TLCTC-XX.YY operational IDs for this release.",
          "items": { "$ref": "#/definitions/operational_def" }
        },
        "notes": { "type": "string" },
        "extensions": { "type": "object" }
      }
    },
    "operational_def": {
      "type": "object",
      "additionalProperties": false,
      "required": ["id", "name", "definition"],
      "properties": {
        "id": {
          "type": "string",
          "pattern": "^TLCTC-(0[1-9]|10)\\.[0-9]{2}$"
        },
        "name": { "type": "string" },
        "definition": { "type": "string" },
        "notes": { "type": "string" }
      }
    },
    "axiom_def": {
      "type": "object",
      "additionalProperties": false,
      "required": ["axiom_id", "statement"],
      "properties": {
        "axiom_id": { "type": "string", "pattern": "^Axiom\\s+[IVXLCDM]+$" },
        "statement": { "type": "string" },
        "notes": { "type": "string" }
      }
    },
    "rule_def": {
      "type": "object",
      "additionalProperties": false,
      "required": ["rule_id", "statement", "enforcement_level"],
      "properties": {
        "rule_id": { "type": "string", "pattern": "^R-[A-Z0-9_-]+$" },
        "statement": { "type": "string" },
        "enforcement_level": { "type": "string", "enum": ["must", "should", "may"] },
        "machine_enforceable": { "type": "boolean" },
        "notes": { "type": "string" }
      }
    },
    "dre_def": {
      "type": "object",
      "additionalProperties": false,
      "required": ["code", "name", "property", "definition"],
      "properties": {
        "code": { "type": "string", "pattern": "^[A-Z][a-z]?$" },
        "name": { "type": "string" },
        "property": { "type": "string", "description": "What fails on the record when this DRE occurs." },
        "definition": { "type": "string" },
        "parent": { "type": "string", "pattern": "^[A-Z]$", "description": "Refinement codes only: the parent code that stays legal whenever the refinement is unknown or irrelevant." },
        "refinements": { "type": "array", "items": { "type": "string", "pattern": "^[A-Z][a-z]$" } },
        "notes": { "type": "string" }
      }
    },
    "partition_row_def": {
      "type": "object",
      "additionalProperties": false,
      "required": ["row_id", "name", "actor", "register", "cluster_applies", "definition"],
      "properties": {
        "row_id": { "type": "string", "enum": ["failure", "error_in_use", "abuse_of_rights", "attack"] },
        "name": { "type": "string" },
        "actor": { "type": "boolean" },
        "intended": { "type": ["boolean", "null"], "description": "null = not asked for this row" },
        "entitled": { "type": ["boolean", "null"], "description": "null = not asked for this row" },
        "register": { "type": "string", "enum": ["operational-risk", "cyber"] },
        "cluster_applies": { "type": "boolean" },
        "definition": { "type": "string" },
        "notes": { "type": "string" }
      }
    },
    "sre_type_def": {
      "type": "object",
      "additionalProperties": false,
      "required": ["type_id", "name", "cluster_applies", "definition"],
      "properties": {
        "type_id": { "type": "string", "enum": ["compromise", "failure"] },
        "name": { "type": "string" },
        "cluster_applies": { "type": "boolean" },
        "definition": { "type": "string" },
        "notes": { "type": "string" }
      }
    }
  }
}
